{
  "tegenstander": {
    "naam": "KFC Voorbeeld",
    "formatie": "4-4-2",
    "samenvatting": "Directe ploeg die snel de diepte zoekt via de spitsen en sterk is bij standaardsituaties.",
    "sterktes": [
      "Lange bal op de spitsen",
      "Kopsterk bij hoekschoppen",
      "Fysieke middenvelders"
    ],
    "zwaktes": [
      "Traag in de omschakeling naar verdedigen",
      "Ruimte tussen de linies",
      "Zwakke linksachter in 1v1"
    ],
    "sleutelspelers": [
      {
        "rugnummer": 9,
        "post": "ST",
        "aandacht": "Sterk in de lucht; altijd dubbel dekken bij lange ballen."
      },
      {
        "rugnummer": 10,
        "post": "CM",
        "aandacht": "Verdeler; druk zetten zodra hij de bal krijgt."
      }
    ]
  },
  "lessen": [
    "Tegen 4-4-2 vonden we vorige maand ruimte tussen hun linies via de #10.",
    "Bij hoekschoppen verdedigend kregen we twee keer een doelpunt aan de tweede paal: extra speler daar."
  ],
  "speelplan": {
    "formatie": "4-3-3",
    "kernboodschap": "Wij hebben de bal en zoeken de ruimte tussen hun linies.",
    "balbezit": [
      "Opbouw met drie (centrale verdedigers + #6).",
      "Snel naar de #8 tussen de linies.",
      "Over de rechterkant hun linksachter 1v1 aanspelen."
    ],
    "balverlies": [
      "Onmiddellijk tegendruk binnen 5 seconden.",
      "Lange bal: centrale verdediger duelleert, de andere dekt af."
    ],
    "omschakeling_aanval": [
      "Eerste pass vooruit naar de flank."
    ],
    "omschakeling_verdediging": [
      "#6 zakt tussen de centrale verdedigers."
    ],
    "pressing": "Middenblok, druk zetten wanneer hun centrale middenvelder de bal krijgt."
  },
  "standaardsituaties": [
    {
      "standaardsituatie_id": null,
      "titel": "Hoekschop aanvallend links",
      "soort": "hoekschop_aanvallend",
      "afspraken": [
        "Inswinger naar de eerste paal.",
        "Lopers starten laat."
      ],
      "taken": [
        {
          "rugnummer": 7,
          "taak": "Trapt de hoekschop."
        },
        {
          "rugnummer": 4,
          "taak": "Eerste paal."
        },
        {
          "rugnummer": 9,
          "taak": "Tweede paal."
        }
      ],
      "tekening": {
        "titel": "Hoekschop aanvallend — links",
        "veld": {
          "type": "half",
          "breedte_m": 68,
          "lengte_m": 30
        },
        "elementen": [
          {
            "soort": "doel",
            "team": null,
            "label": null,
            "x": 50,
            "y": 1
          },
          {
            "soort": "doelman",
            "team": "tegenstander",
            "label": null,
            "x": 50,
            "y": 6
          },
          {
            "soort": "bal",
            "team": null,
            "label": null,
            "x": 3,
            "y": 4
          },
          {
            "soort": "speler",
            "team": "eigen",
            "label": "7",
            "x": 1,
            "y": 1
          },
          {
            "soort": "speler",
            "team": "tegenstander",
            "label": null,
            "x": 43,
            "y": 10
          },
          {
            "soort": "speler",
            "team": "tegenstander",
            "label": null,
            "x": 55,
            "y": 11
          },
          {
            "soort": "speler",
            "team": "tegenstander",
            "label": null,
            "x": 64,
            "y": 14
          },
          {
            "soort": "speler",
            "team": "eigen",
            "label": "4",
            "x": 36,
            "y": 52
          },
          {
            "soort": "speler",
            "team": "eigen",
            "label": "5",
            "x": 50,
            "y": 55
          },
          {
            "soort": "speler",
            "team": "eigen",
            "label": "9",
            "x": 64,
            "y": 50
          },
          {
            "soort": "speler",
            "team": "eigen",
            "label": "8",
            "x": 82,
            "y": 58
          },
          {
            "soort": "speler",
            "team": "eigen",
            "label": "10",
            "x": 50,
            "y": 88
          }
        ],
        "pijlen": [
          {
            "soort": "pass",
            "van_x": 3,
            "van_y": 4,
            "naar_x": 40,
            "naar_y": 20,
            "label": "inswinger"
          },
          {
            "soort": "loop",
            "van_x": 36,
            "van_y": 52,
            "naar_x": 40,
            "naar_y": 24,
            "label": "1e paal"
          },
          {
            "soort": "loop",
            "van_x": 50,
            "van_y": 55,
            "naar_x": 51,
            "naar_y": 27,
            "label": "centraal"
          },
          {
            "soort": "loop",
            "van_x": 64,
            "van_y": 50,
            "naar_x": 62,
            "naar_y": 24,
            "label": "2e paal"
          },
          {
            "soort": "loop",
            "van_x": 82,
            "van_y": 58,
            "naar_x": 70,
            "naar_y": 38,
            "label": "rebound"
          }
        ],
        "zones": [
          {
            "x": 34,
            "y": 16,
            "breedte": 34,
            "hoogte": 16,
            "label": "aanvalszone"
          }
        ],
        "uitleg": [
          "#7 trapt een inswinger naar de eerste paal.",
          "#4, #5 en #9 starten laat en lopen elk naar hun zone.",
          "#8 pakt de rebound, #10 blijft aan de rand van de zestien."
        ]
      }
    },
    {
      "standaardsituatie_id": null,
      "titel": "Hoekschop verdedigend",
      "soort": "hoekschop_verdedigend",
      "afspraken": [
        "Gemengd: drie in zone, twee in mandekking.",
        "#10 blijft vooraan."
      ],
      "taken": [
        {
          "rugnummer": 6,
          "taak": "Dekt hun sterkste kopper."
        },
        {
          "rugnummer": 3,
          "taak": "Eerste paal."
        }
      ],
      "tekening": {
        "titel": "Hoekschop verdedigend — gemengd",
        "veld": {
          "type": "half",
          "breedte_m": 68,
          "lengte_m": 30
        },
        "elementen": [
          {
            "soort": "doel",
            "team": null,
            "label": null,
            "x": 50,
            "y": 1
          },
          {
            "soort": "doelman",
            "team": "eigen",
            "label": "1",
            "x": 50,
            "y": 6
          },
          {
            "soort": "bal",
            "team": null,
            "label": null,
            "x": 98,
            "y": 3
          },
          {
            "soort": "speler",
            "team": "eigen",
            "label": "3",
            "x": 43,
            "y": 6
          },
          {
            "soort": "speler",
            "team": "eigen",
            "label": "9",
            "x": 44,
            "y": 20
          },
          {
            "soort": "speler",
            "team": "eigen",
            "label": "4",
            "x": 50,
            "y": 22
          },
          {
            "soort": "speler",
            "team": "eigen",
            "label": "5",
            "x": 56,
            "y": 20
          },
          {
            "soort": "speler",
            "team": "tegenstander",
            "label": null,
            "x": 36,
            "y": 64
          },
          {
            "soort": "speler",
            "team": "tegenstander",
            "label": null,
            "x": 64,
            "y": 64
          },
          {
            "soort": "speler",
            "team": "eigen",
            "label": "6",
            "x": 38,
            "y": 56
          },
          {
            "soort": "speler",
            "team": "eigen",
            "label": "8",
            "x": 62,
            "y": 56
          },
          {
            "soort": "speler",
            "team": "eigen",
            "label": "10",
            "x": 50,
            "y": 90
          }
        ],
        "pijlen": [
          {
            "soort": "loop",
            "van_x": 38,
            "van_y": 56,
            "naar_x": 42,
            "naar_y": 34,
            "label": "mandekking"
          },
          {
            "soort": "loop",
            "van_x": 62,
            "van_y": 56,
            "naar_x": 58,
            "naar_y": 34,
            "label": null
          }
        ],
        "zones": [
          {
            "x": 38,
            "y": 13,
            "breedte": 24,
            "hoogte": 16,
            "label": "zone"
          }
        ],
        "uitleg": [
          "Zone: #9, #4 en #5 in het doelgebied.",
          "Mandekking: #6 en #8 op de twee gevaarlijkste koppers.",
          "#3 aan de eerste paal, #10 blijft vooraan voor de counter."
        ]
      }
    },
    {
      "standaardsituatie_id": null,
      "titel": "Vrije trap verdedigend",
      "soort": "vrije_trap_verdedigend",
      "afspraken": [
        "Muur van drie.",
        "Laatste lijn op de strafschopstip."
      ],
      "taken": [
        {
          "rugnummer": 7,
          "taak": "Zet de muur."
        }
      ],
      "tekening": {
        "titel": "Vrije trap verdedigend — muur",
        "veld": {
          "type": "half",
          "breedte_m": 68,
          "lengte_m": 30
        },
        "elementen": [
          {
            "soort": "doel",
            "team": null,
            "label": null,
            "x": 50,
            "y": 1
          },
          {
            "soort": "doelman",
            "team": "eigen",
            "label": "1",
            "x": 47,
            "y": 6
          },
          {
            "soort": "bal",
            "team": null,
            "label": null,
            "x": 65,
            "y": 70
          },
          {
            "soort": "speler",
            "team": "tegenstander",